{
  "evidence_groups": [
    {
      "id": "certification",
      "ref_count": 3
    },
    {
      "id": "sandbox",
      "ref_count": 3
    },
    {
      "id": "policy-bundles",
      "ref_count": 3
    },
    {
      "id": "public-compatibility",
      "ref_count": 3
    }
  ],
  "id": "phase18-ecosystem-evidence-bundle",
  "phase": "PHASE-18",
  "reports": [
    {
      "id": "phase18-extension-certification-report",
      "verdict": "pass"
    },
    {
      "id": "phase18-sandbox-profile-report",
      "verdict": "pass"
    },
    {
      "id": "phase18-policy-bundle-report",
      "verdict": "pass"
    },
    {
      "id": "phase18-public-compatibility-report",
      "verdict": "pass"
    }
  ],
  "verdict": "pass"
}
